{
  "analysis": "mtaac_v3_structural_development",
  "claim_scope": {
    "class": "development_only",
    "eligible_as_reserved_validation_result": false,
    "eligible_as_v2_holdout_result": false,
    "individual_predictions_published": false
  },
  "data_boundary": {
    "model_training_family_count": 271,
    "regimes_used": [
      "clean",
      "mild"
    ],
    "replica_index_used": 0,
    "reserved_validation_source_loaded": false,
    "v2_holdout_exposed_to_model": false,
    "v2_holdout_family_count_excluded": 90,
    "v2_holdout_scored": false
  },
  "development_only": true,
  "final_development_model": {
    "candidates": [
      {
        "candidate_id": "gamma-0__lambda-0",
        "complexity_rank": 0,
        "fold_count": 4,
        "gamma": 0.0,
        "mean": 0.2752662355515254,
        "mild_macro_f1_by_fold": [
          0.24565320185418016,
          0.2991160479901848,
          0.27746004787558143,
          0.2788356444861552
        ],
        "standard_error": 0.011042715588323123,
        "transition_strength": 0.0
      },
      {
        "candidate_id": "gamma-0__lambda-0.5",
        "complexity_rank": 1,
        "fold_count": 4,
        "gamma": 0.0,
        "mean": 0.24582595162271773,
        "mild_macro_f1_by_fold": [
          0.22857381436464164,
          0.23104171675946814,
          0.26165539256694864,
          0.26203288279981246
        ],
        "standard_error": 0.009262134649786018,
        "transition_strength": 0.5
      },
      {
        "candidate_id": "gamma-0__lambda-1",
        "complexity_rank": 2,
        "fold_count": 4,
        "gamma": 0.0,
        "mean": 0.20614684345162249,
        "mild_macro_f1_by_fold": [
          0.18070084149519952,
          0.21787947038428487,
          0.20608203755156368,
          0.2199250243754418
        ],
        "standard_error": 0.009013859789612408,
        "transition_strength": 1.0
      },
      {
        "candidate_id": "gamma-0.5__lambda-0",
        "complexity_rank": 3,
        "fold_count": 4,
        "gamma": 0.5,
        "mean": 0.3228407674943642,
        "mild_macro_f1_by_fold": [
          0.3105885401031196,
          0.3326892013509958,
          0.32753510140621345,
          0.3205502271171279
        ],
        "standard_error": 0.004781841273426129,
        "transition_strength": 0.0
      },
      {
        "candidate_id": "gamma-0.5__lambda-0.5",
        "complexity_rank": 4,
        "fold_count": 4,
        "gamma": 0.5,
        "mean": 0.3137010234585954,
        "mild_macro_f1_by_fold": [
          0.29770555381740127,
          0.33825347491803937,
          0.31512529487734037,
          0.3037197702216005
        ],
        "standard_error": 0.008945817863513979,
        "transition_strength": 0.5
      },
      {
        "candidate_id": "gamma-0.5__lambda-1",
        "complexity_rank": 5,
        "fold_count": 4,
        "gamma": 0.5,
        "mean": 0.3038088152923476,
        "mild_macro_f1_by_fold": [
          0.28306300156676356,
          0.339603590418253,
          0.3001137662941949,
          0.29245490289017906
        ],
        "standard_error": 0.012430538428220613,
        "transition_strength": 1.0
      },
      {
        "candidate_id": "gamma-1__lambda-0",
        "complexity_rank": 6,
        "fold_count": 4,
        "gamma": 1.0,
        "mean": 0.27154200049643196,
        "mild_macro_f1_by_fold": [
          0.27631619209668684,
          0.2661763377575119,
          0.2696479115296262,
          0.2740275606019029
        ],
        "standard_error": 0.002261062141926946,
        "transition_strength": 0.0
      },
      {
        "candidate_id": "gamma-1__lambda-0.5",
        "complexity_rank": 7,
        "fold_count": 4,
        "gamma": 1.0,
        "mean": 0.30353151684609125,
        "mild_macro_f1_by_fold": [
          0.30952246549887147,
          0.2977346908721637,
          0.31119324405001086,
          0.29567566696331893
        ],
        "standard_error": 0.003978181098820854,
        "transition_strength": 0.5
      },
      {
        "candidate_id": "gamma-1__lambda-1",
        "complexity_rank": 8,
        "fold_count": 4,
        "gamma": 1.0,
        "mean": 0.32167639961479433,
        "mild_macro_f1_by_fold": [
          0.3234750804249403,
          0.33494182803117484,
          0.3189337141814997,
          0.3093549758215624
        ],
        "standard_error": 0.005311517763355806,
        "transition_strength": 1.0
      }
    ],
    "model_state_commitment": "sha256:d2b332f6d9b2b6acae206f7f0b8db07d7e2431b5995168f7228a374e4f134158",
    "selected_candidate": {
      "candidate_id": "gamma-0.5__lambda-0",
      "complexity_rank": 3,
      "gamma": 0.5,
      "transition_strength": 0.0
    },
    "selection_domain": "indusbench-v3dev:full-selection:v1",
    "selection_fold_count": 4,
    "selection_metric": "family_weighted_mild_macro_f1",
    "selection_rule": "one_standard_error_simplest_lower_gamma_then_lambda"
  },
  "implementation_commit": "5b39c8ba358ea66e46183cbf02eb07fbc91861e2",
  "model_contract": {
    "candidate_grid": [
      {
        "candidate_id": "gamma-0__lambda-0",
        "complexity_rank": 0,
        "gamma": 0.0,
        "transition_strength": 0.0
      },
      {
        "candidate_id": "gamma-0__lambda-0.5",
        "complexity_rank": 1,
        "gamma": 0.0,
        "transition_strength": 0.5
      },
      {
        "candidate_id": "gamma-0__lambda-1",
        "complexity_rank": 2,
        "gamma": 0.0,
        "transition_strength": 1.0
      },
      {
        "candidate_id": "gamma-0.5__lambda-0",
        "complexity_rank": 3,
        "gamma": 0.5,
        "transition_strength": 0.0
      },
      {
        "candidate_id": "gamma-0.5__lambda-0.5",
        "complexity_rank": 4,
        "gamma": 0.5,
        "transition_strength": 0.5
      },
      {
        "candidate_id": "gamma-0.5__lambda-1",
        "complexity_rank": 5,
        "gamma": 0.5,
        "transition_strength": 1.0
      },
      {
        "candidate_id": "gamma-1__lambda-0",
        "complexity_rank": 6,
        "gamma": 1.0,
        "transition_strength": 0.0
      },
      {
        "candidate_id": "gamma-1__lambda-0.5",
        "complexity_rank": 7,
        "gamma": 1.0,
        "transition_strength": 0.5
      },
      {
        "candidate_id": "gamma-1__lambda-1",
        "complexity_rank": 8,
        "gamma": 1.0,
        "transition_strength": 1.0
      }
    ],
    "clean_role": "diagnostic_not_used_for_selection",
    "family_weighting": "equal_total_mass_per_family_per_evaluation_regime",
    "laplace_alpha": 1.0,
    "selection_regime": "mild",
    "states": [
      "context_only",
      "quantity",
      "unit",
      "person_name",
      "settlement_name"
    ],
    "structural_features": [
      "position_bucket",
      "line_length_bucket",
      "reported_direction",
      "damage",
      "observation_status",
      "previous_equality",
      "next_equality",
      "line_frequency_bucket",
      "seen_before",
      "seen_after",
      "line_template"
    ],
    "version": "v3-structural-sequence-v1"
  },
  "model_executed": true,
  "nested_development": {
    "inner_fold_count": 4,
    "out_of_fold_metrics": {
      "clean": {
        "balanced_accuracy": 0.36794424969875505,
        "macro_f1": 0.32959221558835894,
        "per_state": {
          "context_only": {
            "f1": 0.6798659278668033,
            "precision": 0.7002474318617667,
            "predicted_mass": 160.37171596742886,
            "recall": 0.6606373215267276,
            "truth_mass": 169.98719053584895
          },
          "person_name": {
            "f1": 0.44929083794966834,
            "precision": 0.3743356370228461,
            "predicted_mass": 49.935960144024676,
            "recall": 0.5617787662600412,
            "truth_mass": 33.27432536353329
          },
          "quantity": {
            "f1": 0.23887714398560464,
            "precision": 0.3301130292502246,
            "predicted_mass": 23.608704819927954,
            "recall": 0.18715239295330338,
            "truth_mass": 41.64275402412499
          },
          "settlement_name": {
            "f1": 0.0,
            "precision": 0.0,
            "predicted_mass": 0.4103178450867527,
            "recall": 0.0,
            "truth_mass": 8.407521943582825
          },
          "unit": {
            "f1": 0.2799271681397185,
            "precision": 0.20747059662282652,
            "predicted_mass": 36.673301223531766,
            "recall": 0.430152767753703,
            "truth_mass": 17.68820813290994
          }
        },
        "states": [
          "context_only",
          "quantity",
          "unit",
          "person_name",
          "settlement_name"
        ],
        "total_family_mass": 271.0,
        "weighted_accuracy": 0.5402024518452887,
        "weighted_confusion_matrix": {
          "context_only": {
            "context_only": 112.29988224945674,
            "person_name": 27.815141561982283,
            "quantity": 12.101350587218278,
            "settlement_name": 0.4103178450867527,
            "unit": 17.360498292104904
          },
          "person_name": {
            "context_only": 13.878948591277622,
            "person_name": 18.69280945086093,
            "quantity": 0.3181077211388005,
            "settlement_name": 0.0,
            "unit": 0.38445960025593645
          },
          "quantity": {
            "context_only": 23.240358659591006,
            "person_name": 0.8723655446629685,
            "quantity": 7.793541064780796,
            "settlement_name": 0.0,
            "unit": 9.736488755090216
          },
          "settlement_name": {
            "context_only": 3.39657768774397,
            "person_name": 2.4844592153341254,
            "quantity": 0.9432621493987887,
            "settlement_name": 0.0,
            "unit": 1.5832228911059416
          },
          "unit": {